Package,Title,Description,taskview_doe,taskview_survey,criteria
ssrm.logmer,Sample Size Determination for Longitudinal Designs with Binary Outcome,"Provides the necessary sample size for a longitudinal study with binary outcome in order to attain a pre-specified power while strictly maintaining the Type I error rate. Kapur K, Bhaumik R, Tang XC, Hur K, Reda DJ, Bhaumik D (2014) <doi:10.1002/sim.6203>.",no,no,No
SunterSampling,Sunter's sampling design,"Functions for drawing samples according to Sunter's sampling design, and for computing first and second order inclusion probabilities",no,no,No
superb,Get Precision of Means Under Various Designs and Sampling Schemes,"Computes standard error and confidence interval of various descriptive statistics under various designs and sampling schemes. The main function, superbPlot(), can either return a plot or a dataframe with the statistic and its precision interval so that other plotting package can be used. See Cousineau (2017) <doi:10.5709/acp-0214-z> for a review or Cousineau (2005) <doi:10.20982/tqmp.01.1.p042>, Morey (2008) <doi:10.20982/tqmp.04.2.p061>, Baguley (2012) <doi:10.3758/s13428-011-0123-7>, Cousineau & Laurencelle (2016) <doi:10.1037/met0000055>, Cousineau & O'Brien (2014) <doi:10.3758/s13428-013-0441-z>.",no,no,No
surveysd,Survey Standard Error Estimation for Cumulated Estimates and their Differences in Complex Panel Designs,Calculate point estimates and their standard errors in complex household surveys using bootstrap replicates. Bootstrapping considers survey design with a rotating panel. A comprehensive description of the methodology can be found under <https://statistikat.github.io/surveysd/articles/methodology.html>.,no,no,No
SvyNom,Nomograms for Right-Censored Outcomes from Survey Designs,"Builds, evaluates and validates a nomogram with survey data and right-censored outcomes.",no,no,No
svyVGAM,Design-Based Inference in Vector Generalised Linear Models,Provides inference based on the survey package for the wide range of parametric models in the 'VGAM' package.,no,no,No
TEQR,Target Equivalence Range Design,The TEQR package contains software to calculate the operating characteristics for the TEQR and the ACT designs.The TEQR (toxicity equivalence range) design is a toxicity based cumulative cohort design with added safety rules. The ACT (Activity constrained for toxicity) design is also a cumulative cohort design with additional safety rules. The unique feature of this design is that dose is escalated based on lack of activity rather than on lack of toxicity and is de-escalated only if an unacceptable level of toxicity is experienced.,yes,no,No
TestDesign,Optimal Test Design Approach to Fixed and Adaptive Test Construction,"Use the optimal test design approach by Birnbaum (1968, ISBN:9781593119348) and van der Linden (2018) <doi:10.1201/9781315117430> in constructing fixed and adaptive tests. Supports the following mixed-integer programming (MIP) solver packages: 'lpsymphony', 'Rsymphony', 'gurobi', 'lpSolve', and 'Rglpk'. The 'gurobi' package is not available from CRAN; see <https://www.gurobi.com/downloads/>. See vignette for installing 'Rsymphony' package on Mac systems.",no,no,No
titeIR,Isotonic Designs for Phase 1 Trials with Late-Onset Toxicities,"Functions to design phase 1 trials using an isotonic regression based design incorporating time-to-event information. Simulation and design functions are available, which incorporate information about followup and DLTs, and apply isotonic regression to devise estimates of DLT probability.",no,no,No
twowaytests,Two-Way Tests in Independent Groups Designs,"Performs two-way tests in independent groups designs; Parametric Bootstrap based Generalized Test and Generalized Pivotal Quantity based Generalized Test (Weerahandi and Krishnamoorthy, 2019) <doi:10.1080/03610926.2017.1419264>. The package performs descriptive statistics and graphical approaches. Moreover, it assesses variance homogeneity and normality of data in each group via tests and plots. All 'twowaytests' functions are designed for two-way layout.",no,no,No
unikn,Graphical Elements of the University of Konstanz's Corporate Design,"Define and use graphical elements of corporate design manuals in R. The 'unikn' package provides color functions (by defining dedicated colors and color palettes, and commands for changing, viewing, and using them) and styled text elements (e.g., for marking, underlining, or plotting colored titles). The pre-defined range of colors and text functions is based on the corporate design of the University of Konstanz <https://www.uni-konstanz.de/>, but can be adapted and extended for other institutions and purposes.",no,no,No
UScensus2000cdp,US Census 2000 Designated Places Shapefiles and Additional Demographic Data,US Census 2000 Designated Places shapefiles and additional demographic data from the SF1 100 percent files. This data set contains polygon files in lat/lon coordinates and the corresponding demographic data for a number of different variables.,no,no,No
VDSPCalibration,Statistical Methods for Designing and Analyzing a Calibration Study,"Provides statistical methods for the design and analysis of a calibration study, which aims for calibrating measurements using two different methods. The package includes sample size calculation, sample selection, regression analysis with error-in measurements and change-point regression. The method is described in Tian, Durazo-Arvizu, Myers, et al. (2014) <DOI:10.1002/sim.6235>.",no,no,No
acebayes,Optimal Bayesian Experimental Design using the ACE Algorithm,Optimal Bayesian experimental design using the approximate coordinate exchange (ACE) algorithm. See <doi:10.18637/jss.v095.i13>.,yes,no,DoE
activegp,Gaussian Process Based Design and Analysis for the Active Subspace Method,The active subspace method is a sensitivity analysis technique that finds important linear combinations of input variables for a simulator. This package provides functions allowing estimation of the active subspace without gradient information using Gaussian processes as well as sequential experimental design tools to minimize the amount of data required to do so. Implements Wycoff et al. (2019) <arXiv:1907.11572>.,no,no,DoE
ADCT,Adaptive Design in Clinical Trials,"Existing adaptive design methods in clinical trials. The package includes power, stopping boundaries (sample size) calculation functions for two-group group sequential designs, adaptive design with coprimary endpoints, biomarker-informed adaptive design, etc.",no,no,DoE
adoptr,Adaptive Optimal Two-Stage Designs in R,"Optimize one or two-arm, two-stage designs for clinical trials with respect to several pre-implemented objective criteria or implement custom objectives. Optimization under uncertainty and conditional (given stage-one outcome) constraints are supported. See Pilz M, Kunzmann K, Herrmann C, Rauch G, Kieser M. A variational approach to optimal two-stage designs. Statistics in Medicine. 2019;38(21):4159–4171. <doi:10.1002/sim.8291> for details.",no,no,DoE
adpss,Design and Analysis of Locally or Globally Efficient Adaptive Designs,Provides the functions for planning and conducting a clinical trial with adaptive sample size determination. Maximal statistical efficiency will be exploited even when dramatic or multiple adaptations are made. Such a trial consists of adaptive determination of sample size at an interim analysis and implementation of frequentist statistical test at the interim and final analysis with a prefixed significance level. The required assumptions for the stage-wise test statistics are independent and stationary increments and normality. Predetermination of adaptation rule is not required.,no,no,DoE
agricolae,Statistical Procedures for Agricultural Research,"Original idea was presented in the thesis ""A statistical analysis tool for agricultural research"" to obtain the degree of Master on science, National Engineering University (UNI), Lima-Peru. Some experimental data for the examples come from the CIP and others research. Agricolae offers extensive functionality on experimental design especially for agricultural and plant breeding experiments, which can also be useful for other purposes. It supports planning of lattice, Alpha, Cyclic, Complete Block, Latin Square, Graeco-Latin Squares, augmented block, factorial, split and strip plot designs. There are also various analysis facilities for experimental data, e.g. treatment comparison procedures and several non-parametric tests comparison, biodiversity indexes and consensus cluster.",yes,no,DoE
AlgDesign,Algorithmic Experimental Design,"Algorithmic experimental designs. Calculates exact and approximate theory experimental designs for D,A, and I criteria. Very large designs may be created. Experimental designs may be blocked or blocked designs created from a candidate list, using several criteria. The blocking can be done when whole and within plot factors interact.",yes,no,DoE
ALTopt,Optimal Experimental Designs for Accelerated Life Testing,"Creates the optimal (D, U and I) designs for the accelerated life testing with right censoring or interval censoring. It uses generalized linear model (GLM) approach to derive the asymptotic variance-covariance matrix of regression coefficients. The failure time distribution is assumed to follow Weibull distribution with a known shape parameter and log-linear link functions are used to model the relationship between failure time parameters and stress variables. The acceleration model may have multiple stress factors, although most ALTs involve only two or less stress factors. ALTopt package also provides several plotting functions including contour plot, Fraction of Use Space (FUS) plot and Variance Dispersion graphs of Use Space (VDUS) plot. For more details, see Seo and Pan (2015) <doi:10.32614/RJ-2015-029>.",yes,no,DoE
Aoptbdtvc,A-Optimal Block Designs for Comparing Test Treatments with Controls,"A collection of functions to construct A-optimal block designs for comparing test treatments with one or more control(s). Mainly A-optimal balanced treatment incomplete block designs, weighted A-optimal balanced treatment incomplete block designs, A-optimal group divisible treatment designs and A-optimal balanced bipartite block designs can be constructed using the package. The designs are constructed using algorithms based on linear integer programming. To the best of our knowledge, these facilities to construct A-optimal block designs for comparing test treatments with one or more controls are not available in the existing R packages. For more details on designs for tests versus control(s) comparisons, please see Hedayat, A. S. and Majumdar, D. (1984) <doi:10.1080/00401706.1984.10487989> A-Optimal Incomplete Block Designs for Control-Test Treatment Comparisons, Technometrics, 26, 363-370 and Mandal, B. N. , Gupta, V. K., Parsad, Rajender. (2017) <doi:10.1080/03610926.2015.1071394> Balanced treatment incomplete block designs through integer programming. Communications in Statistics - Theory and Methods 46(8), 3728-3737.",no,no,DoE
augmentedRCBD,Analysis of Augmented Randomised Complete Block Designs,"Functions for analysis of data generated from experiments in augmented randomised complete block design according to Federer, W.T. (1961) <doi:10.2307/2527837>. Computes analysis of variance, adjusted means, descriptive statistics, genetic variability statistics etc. Further includes data visualization and report generation functions.",no,no,DoE
bacistool,Bayesian Classification and Information Sharing (BaCIS) Tool for the Design of Multi-Group Phase II Clinical Trials,"Provides the design of multi-group phase II clinical trials with binary outcomes using the hierarchical Bayesian classification and information sharing (BaCIS) model. Subgroups are classified into two clusters on the basis of their outcomes mimicking the hypothesis testing framework. Subsequently, information sharing takes place within subgroups in the same cluster, rather than across all subgroups. This method can be applied to the design and analysis of multi-group clinical trials with binary outcomes. Reference: Nan Chen and J. Jack Lee (2019) <doi:10.1002/bimj.201700275>.",no,no,DoE
BatchExperiments,Statistical Experiments on Batch Computing Clusters,Extends the BatchJobs package to run statistical experiments on batch computing clusters. For further details see the project web page.,yes,no,DoE
BayesCTDesign,Two Arm Bayesian Clinical Trial Design with and Without Historical Control Data,"A set of functions to help clinical trial researchers calculate power and sample size for two-arm Bayesian randomized clinical trials that do or do not incorporate historical control data. At some point during the design process, a clinical trial researcher who is designing a basic two-arm Bayesian randomized clinical trial needs to make decisions about power and sample size within the context of hypothesized treatment effects. Through simulation, the simple_sim() function will estimate power and other user specified clinical trial characteristics at user specified sample sizes given user defined scenarios about treatment effect,control group characteristics, and outcome. If the clinical trial researcher has access to historical control data, then the researcher can design a two-arm Bayesian randomized clinical trial that incorporates the historical data. In such a case, the researcher needs to work through the potential consequences of historical and randomized control differences on trial characteristics, in addition to working through issues regarding power in the context of sample size, treatment effect size, and outcome. If a researcher designs a clinical trial that will incorporate historical control data, the researcher needs the randomized controls to be from the same population as the historical controls. What if this is not the case when the designed trial is implemented? During the design phase, the researcher needs to investigate the negative effects of possible historic/randomized control differences on power, type one error, and other trial characteristics. Using this information, the researcher should design the trial to mitigate these negative effects. Through simulation, the historic_sim() function will estimate power and other user specified clinical trial characteristics at user specified sample sizes given user defined scenarios about historical and randomized control differences as well as treatment effects and outcomes. The results from historic_sim() and simple_sim() can be printed with print_table() and graphed with plot_table() methods. Outcomes considered are Gaussian, Poisson, Bernoulli, Lognormal, Weibull, and Piecewise Exponential.",no,no,DoE
baymedr,Computation of Bayes Factors for Common Biomedical Designs,"BAYesian inference for MEDical designs in R. Functions for the computation of Bayes factors for common biomedical research designs. Implemented are functions to test the equivalence (equiv_bf), non-inferiority (infer_bf), and superiority (super_bf) of an experimental group compared to a control group on a continuous outcome measure. Bayes factors for these three tests can be computed based on raw data (x, y) or summary statistics (n_x, n_y, mean_x, mean_y, sd_x, sd_y [or ci_margin and ci_level]).",no,no,DoE
BCHM,Clinical Trial Calculation Based on BCHM Design,"Users can estimate the treatment effect for multiple subgroups basket trials based on the Bayesian Cluster Hierarchical Model (BCHM). In this model, a Bayesian non-parametric method is applied to dynamically calculate the number of clusters by conducting the multiple cluster classification based on subgroup outcomes. Hierarchical model is used to compute the posterior probability of treatment effect with the borrowing strength determined by the Bayesian non-parametric clustering and the similarities between subgroups. To use this package, 'JAGS' software and 'rjags' package are required, and users need to pre-install them.",no,no,DoE
bcrm,Bayesian Continual Reassessment Method for Phase I Dose-Escalation Trials,"Implements a wide variety of one- and two-parameter Bayesian CRM designs. The program can run interactively, allowing the user to enter outcomes after each cohort has been recruited, or via simulation to assess operating characteristics. See Sweeting et al. (2013): <doi:10.18637/jss.v054.i13>.",yes,no,DoE
BDEsize,Efficient Determination of Sample Size in Balanced Design of Experiments,"Provides the sample size in balanced design of experiments and three graphs ; detectable standardized effect size vs power, sample size vs detectable standardized effect size, and sample size vs power. Sample size is computed in order to detect a certain standardized effect size with power at the significance level. Three graphs show the mutual relationship between the sample size, power and the detectable standardized effect size. By investigating those graphs, it can be checked that which effects are sensitive to the efficient sample size determination. Lenth,R.V.(2006-9) <http://www.stat.uiowa.edu/~rlenth/Power> Lim, Yong Bin (1998) Marvin, A., Kastenbaum, A. and Hoel, D.G. (1970) <doi:10.2307/2334851> Montgomery, Douglas C. (2013, ISBN: 0849323312).",no,no,DoE
BDP2,Bayesian Adaptive Designs for Phase II Trials with Binary Endpoint,"Tools and workflow to choose design parameters in Bayesian adaptive single-arm phase II trial designs with binary endpoint (response, success) with possible stopping for efficacy and futility at interim analyses. Also contains routines to determine and visualize operating characteristics. See Kopp-Schneider et al. (2018) <doi:10.1002/bimj.201700209>.",no,no,DoE
bdpv,Inference and Design for Predictive Values in Diagnostic Tests,Computation of asymptotic confidence intervals for negative and positive predictive values in binary diagnostic tests in case-control studies. Experimental design for hypothesis tests on predictive values.,no,no,DoE
BHH2,"Useful Functions for Box, Hunter and Hunter II","Functions and data sets reproducing some examples in Box, Hunter and Hunter II. Useful for statistical design of experiments, especially factorial experiments.",yes,no,DoE
binGroup,Evaluation and Experimental Design for Binomial Group Testing,"Methods for estimation and hypothesis testing of proportions in group testing designs: methods for estimating a proportion in a single population (assuming sensitivity and specificity equal to 1 in designs with equal group sizes), as well as hypothesis tests and functions for experimental design for this situation. For estimating one proportion or the difference of proportions, a number of confidence interval methods are included, which can deal with various different pool sizes. Further, regression methods are implemented for simple pooling and matrix pooling designs. Methods for identification of positive items in group testing designs: Optimal testing configurations can be found for hierarchical and array-based algorithms. Operating characteristics can be calculated for testing configurations across a wide variety of situations.",no,no,DoE
blockRAR,Block Design for Response-Adaptive Randomization,"Computes power for response-adaptive randomization with a block design that captures both the time and treatment effect. T. Chandereng, R. Chappell (2019) <arXiv:1904.07758>.",no,no,DoE
blocksdesign,Nested and Crossed Block Designs for Factorial and Unstructured Treatment Sets,"Constructs treatment and block designs for linear treatment models with crossed or nested block factors. The treatment design can be any feasible linear model and the block design can be any feasible combination of crossed or nested block factors. The block design is a sum of one or more block factors and the block design is optimized sequentially with the levels of each successive block factor optimized conditional on all previously optimized block factors. D-optimality is used throughout except for square or rectangular lattice block designs which are constructed algebraically using mutually orthogonal Latin squares. Crossed block designs with interaction effects are optimized using a weighting scheme which allows for differential weighting of first and second-order block effects. Outputs include a table showing the allocation of treatments to blocks and tables showing the achieved D-efficiency factors for each block and treatment design. Edmondson, R.N. Multi-level Block Designs for Comparative Experiments. JABES 25, 500–522 (2020) <doi:10.1007/s13253-020-00416-0>.",yes,no,DoE
blockTools,"Block, Assign, and Diagnose Potential Interference in Randomized Experiments","Blocks units into experimental blocks, with one unit per treatment condition, by creating a measure of multivariate distance between all possible pairs of units. Maximum, minimum, or an allowable range of differences between units on one variable can be set. Randomly assign units to treatment conditions. Diagnose potential interference between units assigned to different treatment conditions. Write outputs to .tex and .csv files.",yes,no,DoE
blrm,Dose Escalation Design in Phase I Oncology Trial Using Bayesian Logistic Regression Modeling,Plan dose escalation design using adaptive Bayesian logistic regression modeling in Phase I oncology trial.,no,no,DoE
BOIN,Bayesian Optimal INterval (BOIN) Design for Single-Agent and Drug- Combination Phase I Clinical Trials,"The Bayesian optimal interval (BOIN) design is a novel phase I clinical trial design for finding the maximum tolerated dose (MTD). It can be used to design both single-agent and drug-combination trials. The BOIN design is motivated by the top priority and concern of clinicians when testing a new drug, which is to effectively treat patients and minimize the chance of exposing them to subtherapeutic or overly toxic doses. The prominent advantage of the BOIN design is that it achieves simplicity and superior performance at the same time. The BOIN design is algorithm-based and can be implemented in a simple way similar to the traditional 3+3 design. The BOIN design yields an average performance that is comparable to that of the continual reassessment method (CRM, one of the best model-based designs) in terms of selecting the MTD, but has a substantially lower risk of assigning patients to subtherapeutic or overly toxic doses. For tutorial, please check Yan et al. (2020) <doi:10.18637/jss.v094.i13>.",yes,no,DoE
Boptbd,Bayesian Optimal Block Designs,"Computes Bayesian A- and D-optimal block designs under the linear mixed effects model settings using block/array exchange algorithm of Debusho, Gemechu and Haines (2018) <doi:10.1080/03610918.2018.1429617> where the interest is in a comparison of all possible elementary treatment contrasts. The package also provides an optional method of using the graphical user interface (GUI) R package 'tcltk' to ensure that it is user friendly.",no,no,DoE
bwsTools,Tools for Case 1 Best-Worst Scaling (MaxDiff) Designs,"Tools to design best-worst scaling designs (i.e., balanced incomplete block designs) and to analyze data from these designs, using aggregate and individual methods such as: difference scores, Louviere, Lings, Islam, Gudergan, & Flynn (2013) <doi:10.1016/j.ijresmar.2012.10.002>; analytical estimation, Lipovetsky & Conklin (2014) <doi:10.1016/j.jocm.2014.02.001>; empirical Bayes, Lipovetsky & Conklin (2015) <doi:10.1142/S1793536915500028>; Elo, Hollis (2018) <doi:10.3758/s13428-017-0898-2>; and network-based measures.",no,no,DoE
clinfun,Clinical Trial Design and Data Analysis Functions,Utilities to make your clinical collaborations easier if not fun. It contains functions for designing studies such as Simon 2-stage and group sequential designs and for data analysis such as Jonckheere-Terpstra test and estimating survival quantiles.,no,no,DoE
cofad,Contrast Analyses for Factorial Designs,"Contrast analysis for factorial designs is an alternative to the classical ANOVA approach with the advantage of testing focused hypothesis. The method is mainly based on Rosenthal, Rosnow and Rubin (2000, ISBN:978-0521659802) and Sedlmeier and Renkewitz (2018, ISBN:978-3868943214).",no,no,DoE
CombinS,Construction Methods of some Series of PBIB Designs,"Series of partially balanced incomplete block designs (PBIB) based on the combinatory method (S) introduced in (Imane Rezgui et al, 2014) <doi:10.3844/jmssp.2014.45.48>; and it gives their associated U-type design.",yes,no,DoE
CompAREdesign,Statistical Functions for the Design of Studies with Composite Endpoints,"It has been designed to calculate the required sample size in randomized clinical trials with composite endpoints. This package also includes functions to calculate the probability of observing the composite endpoint and the expected effect on the composite endpoint, among others. The methods implemented can be found in Bofill & Gómez (2019) <doi:10.1002/sim.8092> and Gómez & Lagakos (2013) <doi:10.1002/sim.5547>.",no,no,DoE
conf.design,Construction of factorial designs,This small library contains a series of simple tools for constructing and manipulating confounded and fractional factorial designs.,yes,no,DoE
crossdes,Construction of Crossover Designs,Contains functions for the construction of carryover balanced crossover designs. In addition contains functions to check given designs for balance.,yes,no,DoE
Crossover,Analysis and Search of Crossover Designs,Generate and analyse crossover designs from combinatorial or search algorithms as well as from literature and a GUI to access them.,no,no,DoE
