Package,Title,Description,taskview_doe,taskview_survey,criteria
metaplot,Data-Driven Plot Design,"Designs plots in terms of core structure. See 'example(metaplot)'. Primary arguments are (unquoted) column names; order and type (numeric or not) dictate the resulting plot. Specify any y variables, x variable, any groups variable, and any conditioning variables to metaplot() to generate density plots, boxplots, mosaic plots, scatterplots, scatterplot matrices, or conditioned plots. Use multiplot() to arrange plots in grids. Wherever present, scalar column attributes 'label' and 'guide' are honored, producing fully annotated plots with minimal effort. Attribute 'guide' is typically units, but may be encoded() to provide interpretations of categorical values (see '?encode'). Utility unpack() transforms scalar column attributes to row values and pack() does the reverse, supporting tool-neutral storage of metadata along with primary data. The package supports customizable aesthetics such as such as reference lines, unity lines, smooths, log transformation, and linear fits. The user may choose between trellis and ggplot output. Compact syntax and integrated metadata promote workflow scalability.",no,no,No
mined,Minimum Energy Designs,"This is a method (MinED) for mining probability distributions using deterministic sampling which is proposed by Joseph, Wang, Gu, Lv, and Tuo (2018). The MinED samples can be used for approximating the target distribution. They can be generated from a density function that is known only up to a proportionality constant and thus, it might find applications in Bayesian computation. Moreover, the MinED samples are generated with much fewer evaluations of the density function compared to random sampling-based methods such as MCMC and therefore, this method will be especially useful when the unnormalized posterior is expensive or time consuming to evaluate.",no,no,No
minimalRSD,Minimally Changed CCD and BBD,Generate central composite designs (CCD)with full as well as fractional factorial points (half replicate) and Box Behnken designs (BBD) with minimally changed run sequence.,yes,no,No
obfuscatoR,Obfuscation Game Designs,"When people make decisions, they may do so using a wide variety of decision rules. The package allows users to easily create obfuscation games to test the obfuscation hypothesis. It provides an easy to use interface and multiple options designed to vary the difficulty of the game and tailor it to the user's needs. For more detail: Chorus et al., 2021, Obfuscation maximization-based decision-making: Theory, methodology and first empirical evidence, Mathematical Social Sciences, 109, 28-44.",no,no,No
ODS,Statistical Methods for Outcome-Dependent Sampling Designs,"Outcome-dependent sampling (ODS) schemes are cost-effective ways to enhance study efficiency. In ODS designs, one observes the exposure/covariates with a probability that depends on the outcome variable. Popular ODS designs include case-control for binary outcome, case-cohort for time-to-event outcome, and continuous outcome ODS design (Zhou et al. 2002) <doi: 10.1111/j.0006-341X.2002.00413.x>. Because ODS data has biased sampling nature, standard statistical analysis such as linear regression will lead to biases estimates of the population parameters. This package implements four statistical methods related to ODS designs: (1) An empirical likelihood method analyzing the primary continuous outcome with respect to exposure variables in continuous ODS design (Zhou et al., 2002). (2) A partial linear model analyzing the primary outcome in continuous ODS design (Zhou, Qin and Longnecker, 2011) <doi: 10.1111/j.1541-0420.2010.01500.x>. (3) Analyze a secondary outcome in continuous ODS design (Pan et al. 2018) <doi: 10.1002/sim.7672>. (4) An estimated likelihood method analyzing a secondary outcome in case-cohort data (Pan et al. 2017) <doi: 10.1111/biom.12838>.",no,no,No
onewaytests,One-Way Tests in Independent Groups Designs,"Performs one-way tests in independent groups designs; one-way analysis of variance (ANOVA), Welch's heteroscedastic F test, Welch's heteroscedastic F test with trimmed means and Winsorized variances, Brown-Forsythe test, Alexander-Govern test, James second order test, Kruskal-Wallis test, Scott-Smith test, Box F test and Johansen F test, Generalized tests equivalent to Parametric Bootstrap and Fiducial tests. The package performs pairwise comparisons and graphical approaches. Also, the package includes Student's t test, Welch's t test and Mann-Whitney U test for two samples. Moreover, it assesses variance homogeneity and normality of data in each group via tests and plots (Dag et al., 2018, <https://journal.r-project.org/archive/2018/RJ-2018-022/RJ-2018-022.pdf>).",no,no,No
OptimaRegion,Confidence Regions for Optima,Computes confidence regions on the location of response surface optima.,yes,no,No
OptInterim,Optimal Two and Three Stage Designs for Single-Arm and Two-Arm Randomized Controlled Trials with a Long-Term Binary Endpoint,Optimal two and three stage designs monitoring time-to-event endpoints at a specified timepoint,yes,no,No
ordcrm,Likelihood-Based Continual Reassessment Method (CRM) Dose Finding Designs,"Provides the setup and calculations needed to run a likelihood-based continual reassessment method (CRM) dose finding trial and performs simulations to assess design performance under various scenarios. 3 dose finding designs are included in this package: ordinal proportional odds model (POM) CRM, ordinal continuation ratio (CR) model CRM, and the binary 2-parameter logistic model CRM. These functions allow customization of design characteristics to vary sample size, cohort sizes, target dose-limiting toxicity (DLT) rates, discrete or continuous dose levels, combining ordinal grades 0 and 1 into one category, and incorporate safety and/or stopping rules. For POM and CR model designs, ordinal toxicity grades are specified by common terminology criteria for adverse events (CTCAE) version 4.0. Function 'pseudodata' creates the necessary starting models for these 3 designs, and function 'nextdose' estimates the next dose to test in a cohort of patients for a target DLT rate. We also provide the function 'crmsimulations' to assess the performance of these 3 dose finding designs under various scenarios.",no,no,No
osDesign,"Design, Planning and Analysis of Observational Studies","A suite of functions for the design of case-control and two-phase studies, and the analysis of data that arise from them. Functions in this packages provides Monte Carlo based evaluation of operating characteristics such as powers for estimators of the components of a logistic regression model. For additional detail see: Haneuse S, Saegusa T and Lumley T (2011)<doi:10.18637/jss.v043.i11>.",no,no,No
PharmPow,Pharmacometric Power calculations for mixed study designs,This package contains functions performing power calculations for mixed (sparse/dense sampled) pharmacokinetic study designs. The input data for these functions is tailored for NONMEM .phi files.,no,no,No
plfMA,"A GUI to View, Design and Export Various Graphs of Data",Provides a graphical user interface for viewing and designing various types of graphs of the data. The graphs can be saved in different formats of an image.,no,no,No
plgp,Particle Learning of Gaussian Processes,"Sequential Monte Carlo inference for fully Bayesian Gaussian process (GP) regression and classification models by particle learning (PL). The sequential nature of inference and the active learning (AL) hooks provided facilitate thrifty sequential design (by entropy) and optimization (by improvement) for classification and regression models, respectively. This package essentially provides a generic PL interface, and functions (arguments to the interface) which implement the GP models and AL heuristics. Functions for a special, linked, regression/classification GP model and an integrated expected conditional improvement (IECI) statistic is provides for optimization in the presence of unknown constraints. Separable and isotropic Gaussian, and single-index correlation functions are supported. See the examples section of ?plgp and demo(package=""plgp"") for an index of demos",yes,no,No
populationPDXdesign,Designing Population PDX Studies,Run simulations to assess the impact of various designs features and the underlying biological behaviour on the outcome of a Patient Derived Xenograft (PDX) population study. This project can either be deployed to a server as a 'shiny' app or installed locally as a package and run the app using the command 'populationPDXdesignApp()'.,no,no,No
powerbydesign,Power Estimates for ANOVA Designs,Functions for bootstrapping the power of ANOVA designs based on estimated means and standard deviations of the conditions. Please refer to the documentation of the boot.power.anova() function for further details.,yes,no,No
powerGWASinteraction,Power Calculations for GxE and GxG Interactions for GWAS,Analytical power calculations for GxE and GxG interactions for case-control studies of candidate genes and genome-wide association studies (GWAS). This includes power calculation for four two-step screening and testing procedures. It can also calculate power for GxE and GxG without any screening.,yes,no,No
powerpkg,Power analyses for the affected sib pair and the TDT design,"(1) To estimate the power of testing for linkage using an affected sib pair design, as a function of the recurrence risk ratios. We will use analytical power formulae as implemented in R. These are based on a Mathematica notebook created by Martin Farrall. (2) To examine how the power of the transmission disequilibrium test (TDT) depends on the disease allele frequency, the marker allele frequency, the strength of the linkage disequilibrium, and the magnitude of the genetic effect. We will use an R program that implements the power formulae of Abel and Muller-Myhsok (1998). These formulae allow one to quickly compute power of the TDT approach under a variety of different conditions. This R program was modeled on Martin Farrall's Mathematica notebook.",no,no,No
PracTools,Tools for Designing and Weighting Survey Samples,"Functions and datasets to support Valliant, Dever, and Kreuter, ``Practical Tools for Designing and Weighting Survey Samples'' (2nd edition, 2018). Contains functions for sample size calculation for survey samples using stratified or clustered one-, two-, and three-stage sample designs. Other functions compute variance components for multistage designs and sample sizes in two-phase designs. A number of example data sets are included.",no,yes,No
PRDA,Conduct a Prospective or Retrospective Design Analysis,"An implementation of the ""Design Analysis"" proposed by Gelman and Carlin (2014) <doi:10.1177/1745691614551642>. It combines the evaluation of Power-Analysis with other inferential-risks as Type-M error (i.e. Magnitude) and Type-S error (i.e. Sign). See also Altoè et al. (2020) <doi:10.3389/fpsyg.2019.02893> and Bertoldo et al. (2020) <doi:10.31234/osf.io/q9f86>.",no,no,No
precautionary,Safety Diagnostics for Dose-Escalation Trial Designs,"Enhances various R packages that support the design and simulation of phase 1 dose-escalation trials, adding diagnostics to examine the safety characteristics of these designs in light of expected inter-individual variation in pharmacokinetics and pharmacodynamics. See Norris (2020b), ""Retrospective analysis of a fatal dose-finding trial"" <arXiv:2004.12755> and (2020c) ""What Were They Thinking? Pharmacologic priors implicit in a choice of 3+3 dose-escalation design"" <arXiv:2012.05301>.",no,no,No
preference,2-Stage Preference Trial Design and Analysis,"Design and analyze two-stage randomized trials with a continuous outcome measure. The package contains functions to compute the required sample size needed to detect a given preference, treatment, and selection effect; alternatively, the package contains functions that can report the study power given a fixed sample size. Finally, analysis functions are provided to test each effect using either summary data (i.e. means, variances) or raw study data <doi:10.18637/jss.v094.c02>.",no,no,No
ProbSamplingI,Probabilistic Sampling Design and Strategies,"It allows the user to determine sample sizes, select probabilistic samples, make estimates of different parameters for the total finite population and in studio domains, using the main design drawings.",no,no,No
PWEALL,Design and Monitoring of Survival Trials Accounting for Complex Situations,"Calculates various functions needed for design and monitoring survival trials accounting for complex situations such as delayed treatment effect, treatment crossover, non-uniform accrual, and different censoring distributions between groups. The event time distribution is assumed to be piecewise exponential (PWE) distribution and the entry time is assumed to be piecewise uniform distribution. As compared with Version 1.2.1, two more types of hybrid crossover are added. A bug is corrected in the function ""pwecx"" that calculates the crossover-adjusted survival, distribution, density, hazard and cumulative hazard functions. Also, to generate the crossover-adjusted event time random variable, a more efficient algorithm is used and the output includes crossover indicators.",no,no,No
pwr2ppl,Power Analyses for Common Designs (Power to the People),"Statistical power analysis for designs including t-tests, correlations, multiple regression, ANOVA, mediation, and logistic regression. Functions accompany Aberson (2019) <doi:10.4324/9781315171500>.",no,no,No
PwrGSD,Power in a Group Sequential Design,"Tools for the evaluation of interim analysis plans for sequentially monitored trials on a survival endpoint; tools to construct efficacy and futility boundaries, for deriving power of a sequential design at a specified alternative, template for evaluating the performance of candidate plans at a set of time varying alternatives. See Izmirlian, G. (2014) <doi:10.4310/SII.2014.v7.n1.a4>.",no,no,No
R6P,Design Patterns in R,"Build robust and maintainable software with object-oriented design patterns in R. Design patterns abstract and present in neat, well-defined components and interfaces the experience of many software designers and architects over many years of solving similar problems. These are solutions that have withstood the test of time with respect to re-usability, flexibility, and maintainability. 'R6P' provides abstract base classes with examples for a few known design patterns. The patterns were selected by their applicability to analytic projects in R. Using these patterns in R projects have proven effective in dealing with the complexity that data-driven applications possess.",no,no,No
randquotes,Get Random Quotes from Quotes on Design API,Connects to the site <http://quotesondesign.com/> that uses the 'WordPress' built-in REST API to provide a way for you to grab quotes.,no,no,No
recipes,Preprocessing Tools to Create Design Matrices,"An extensible framework to create and preprocess design matrices. Recipes consist of one or more data manipulation and analysis ""steps"". Statistical parameters for the steps can be estimated from an initial data set and then applied to other data sets. The resulting design matrices can then be used as inputs into statistical or machine learning models.",no,no,No
reservoir,"Tools for Analysis, Design, and Operation of Water Supply Storages","Measure single-storage water supply system performance using resilience, reliability, and vulnerability metrics; assess storage-yield-reliability relationships; determine no-fail storage with sequent peak analysis; optimize release decisions for water supply, hydropower, and multi-objective reservoirs using deterministic and stochastic dynamic programming; generate inflow replicates using parametric and non-parametric models; evaluate inflow persistence using the Hurst coefficient.",no,no,No
riskParityPortfolio,Design of Risk Parity Portfolios,"Fast design of risk parity portfolios for financial investment. The goal of the risk parity portfolio formulation is to equalize or distribute the risk contributions of the different assets, which is missing if we simply consider the overall volatility of the portfolio as in the mean-variance Markowitz portfolio. In addition to the vanilla formulation, where the risk contributions are perfectly equalized subject to no shortselling and budget constraints, many other formulations are considered that allow for box constraints and shortselling, as well as the inclusion of additional objectives like the expected return and overall variance. See vignette for a detailed documentation and comparison, with several illustrative examples. The package is based on the papers: Y. Feng, and D. P. Palomar (2015). SCRIP: Successive Convex Optimization Methods for Risk Parity Portfolio Design. IEEE Trans. on Signal Processing, vol. 63, no. 19, pp. 5285-5300. <doi:10.1109/TSP.2015.2452219>. F. Spinu (2013), An Algorithm for Computing Risk Parity Weights. <doi:10.2139/ssrn.2297383>. T. Griveau-Billion, J. Richard, and T. Roncalli (2013). A fast algorithm for computing High-dimensional risk parity portfolios. <arXiv:1311.4057>.",no,no,No
rolocISCCNBS,A Colour List and Colour Metric Based on the ISCC-NBS System of Color Designation,A colour list and colour metric based on the ISCC-NBS System of Color Designation for use with the 'roloc' package for converting colour specifications to colour names.,no,no,No
RPPairwiseDesign,Resolvable partially pairwise balanced design and Space-filling design via association scheme,Using some association schemes to obtain a new series of resolvable partially pairwise balanced designs (RPPBD) and space-filling designs.,yes,no,No
RSurveillance,Design and Analysis of Disease Surveillance Activities,"A range of functions for the design and analysis of disease surveillance activities. These functions were originally developed for animal health surveillance activities but can be equally applied to aquatic animal, wildlife, plant and human health surveillance activities. Utilities are included for sample size calculation and analysis of representative surveys for disease freedom, risk-based studies for disease freedom and for prevalence estimation. This package is based on Cameron A., Conraths F., Frohlich A., Schauer B., Schulz K., Sergeant E., Sonnenburg J., Staubach C. (2015). R package of functions for risk-based surveillance. Deliverable 6.24, WP 6 - Decision making tools for implementing risk-based surveillance, Grant Number no. 310806, RISKSUR (<https://www.fp7-risksur.eu/sites/default/files/documents/Deliverables/RISKSUR_%28310806%29_D6.24.pdf>). Many of the 'RSurveillance' functions are incorporated into the 'epitools' website: Sergeant, ESG, 2019. Epitools epidemiological calculators. Ausvet Pty Ltd. Available at: <http://epitools.ausvet.com.au>.",no,no,No
sampler,"Sample Design, Drawing & Data Analysis Using Data Frames","Determine sample sizes, draw samples, and conduct data analysis using data frames. It specifically enables you to determine simple random sample sizes, stratified sample sizes, and complex stratified sample sizes using a secondary variable such as population; draw simple random samples and stratified random samples from sampling data frames; determine which observations are missing from a random sample, missing by strata, duplicated within a dataset; and perform data analysis, including proportions, margins of error and upper and lower bounds for simple, stratified and cluster sample designs.",no,no,No
scan,Single-Case Data Analyses for Single and Multiple Baseline Designs,"A collection of procedures for analysing, visualising, and managing single-case data. These include piecewise linear regression models, multilevel models, overlap indices (PND, PEM, PAND, PET, tauU, baseline corrected tau), and randomization tests. Data preparation functions support outlier detection, handling missing values, scaling, truncating, rank transformation, and smoothing. An exporting function helps to generate html and latex tables in a publication friendly style. More details can be found at <https://jazznbass.github.io/scan-Book/>.",no,no,No
SDaA,Sampling: Design and Analysis,"Functions and Datasets from Lohr, S. (1999), Sampling: Design and Analysis, Duxbury.",no,yes,No
SensoMineR,Sensory Data Analysis,Statistical Methods to Analyse Sensory Data. SensoMineR: A package for sensory data analysis. S. Le and F. Husson (2008) <DOI:10.1111/j.1745-459X.2007.00137.x>.,yes,no,No
sFFLHD,Sequential Full Factorial-Based Latin Hypercube Design,"Gives design points from a sequential full factorial-based Latin hypercube design, as described in Duan, Ankenman, Sanchez, and Sanchez (2015, Technometrics, <doi:10.1080/00401706.2015.1108233>).",yes,no,No
shinymaterial,Implement Material Design in Shiny Applications,Allows shiny developers to incorporate UI elements based on Google's Material design. See <https://material.io/guidelines/> for more information.,no,no,No
sim2Dpredictr,Simulate Outcomes Using Spatially Dependent Design Matrices,"Provides tools for simulating spatially dependent predictors (continuous or binary), which are used to generate scalar outcomes in a (generalized) linear model framework. Continuous predictors are generated using traditional multivariate normal distributions or Gauss Markov random fields with several correlation function approaches (e.g., see Rue (2001) <doi:10.1111/1467-9868.00288> and Furrer and Sain (2010) <doi:10.18637/jss.v036.i10>), while binary predictors are generated using a Boolean model (see Cressie and Wikle (2011, ISBN: 978-0-471-69274-4)). Parameter vectors exhibiting spatial clustering can also be easily specified by the user.",no,no,No
SimDesign,Structure for Organizing Monte Carlo Simulation Designs,"Provides tools to help safely and efficiently organize Monte Carlo simulations in R. The package controls the structure and back-end of Monte Carlo simulations by utilizing a general generate-analyse-summarise strategy. The functions provided control common simulation issues such as re-simulating non-convergent results, support parallel back-end and MPI distributed computations, save and restore temporary files, aggregate results across independent nodes, and provide native support for debugging. For a pedagogical introduction to the package refer to Sigal and Chalmers (2016) <doi:10.1080/10691898.2016.1246953>, and for an in-depth overview of the package and its design philosophy see Chalmers and Adkins (2020) <doi:10.20982/tqmp.16.4.p248>.",no,no,No
smartsizer,Power Analysis for a SMART Design,"A set of tools for determining the necessary sample size in order to identify the optimal dynamic treatment regime in a sequential, multiple assignment, randomized trial (SMART). Utilizes multiple comparisons with the best methodology to adjust for multiple comparisons. Designed for an arbitrary SMART design. Please see Artman (2018) <doi:10.1093/biostatistics/kxy064> for more details.",no,no,No
sparseIndexTracking,Design of Portfolio of Stocks to Track an Index,"Computation of sparse portfolios for financial index tracking, i.e., joint selection of a subset of the assets that compose the index and computation of their relative weights (capital allocation). The level of sparsity of the portfolios, i.e., the number of selected assets, is controlled through a regularization parameter. Different tracking measures are available, namely, the empirical tracking error (ETE), downside risk (DR), Huber empirical tracking error (HETE), and Huber downside risk (HDR). See vignette for a detailed documentation and comparison, with several illustrative examples. The package is based on the paper: K. Benidis, Y. Feng, and D. P. Palomar, ""Sparse Portfolios for High-Dimensional Financial Index Tracking,"" IEEE Trans. on Signal Processing, vol. 66, no. 1, pp. 155-170, Jan. 2018. <doi:10.1109/TSP.2017.2762286>.",no,no,No
SPmlficmcm,Semiparametric Maximum Likelihood Method for Interactions Gene-Environment in Case-Mother Control-Mother Designs,Implements the method of general semiparametric maximum likelihood estimation for logistic models in case-mother control-mother designs.,no,no,No
spsurvey,Spatial Survey Design and Analysis,"These functions provide procedures for selecting sites for spatial surveys using spatially balanced algorithms applied to discrete points, linear networks, or polygons. The probability survey designs available include independent random samples, stratified random samples, and unequal probability random samples (categorical or probability proportional to size). Design-based estimation based on the results from surveys is available for estimating totals, means, quantiles, CDFs, and linear models. The analyses rely on package survey for most results. Variance estimation options include a local neighborhood variance estimator that is appropriate for spatially-balanced survey designs. A reference for the survey design portion of the package is: D. L. Stevens, Jr. and A. R. Olsen (2004), ""Spatially-balanced sampling of natural resources."", Journal of the American Statistical Association 99(465): 262-278, <DOI:10.1198/016214504000000250>. Additional helpful references for this package are A. R. Olsen, T. M. Kincaid, and Q. Payton (2012) and T. M. Kincaid and A. R. Olsen (2012), both of which are chapters in the book ""Design and Analysis of Long-Term Ecological Monitoring Studies"" (R. A. Gitzen, J. J. Millspaugh, A. B. Cooper, and D. S. Licht (eds.), Cambridge University Press, New York, <Online ISBN:9781139022422>).",no,yes,No
