Package,Title,Description,taskview_doe,taskview_survey,criteria
agridat,Agricultural Datasets,"Datasets from books, papers, and websites related to agriculture. Example graphics and analyses are included. Data come from small-plot trials, multi-environment trials, uniformity trials, yield monitors, and more.",yes,no,No
apdesign,An Implementation of the Additive Polynomial Design Matrix,An implementation of the additive polynomial (AP) design matrix. It constructs and appends an AP design matrix to a data frame for use with longitudinal data subject to seasonality.,no,no,No
argonR,R Interface to Argon HTML Design,R wrapper around the argon HTML library. More at <https://demos.creative-tim.com/argon-design-system/>.,no,no,No
asd,Simulations for Adaptive Seamless Designs,Package runs simulations for adaptive seamless designs with and without early outcomes for treatment selection and subpopulation type designs.,yes,no,No
BayesFactor,Computation of Bayes Factors for Common Designs,"A suite of functions for computing various Bayes factors for simple designs, including contingency tables, one- and two-sample designs, one-way designs, general ANOVA designs, and linear regression.",no,no,No
binseqtest,Exact Binary Sequential Designs and Analysis,"For a series of binary responses, create stopping boundary with exact results after stopping, allowing updating for missing assessments.",yes,no,No
BsMD,Bayes Screening and Model Discrimination,Bayes screening and model discrimination follow-up designs.,yes,no,No
card,Cardiovascular and Autonomic Research Design,"Tools that can aid in the assessment of the autonomic regulation of cardiovascular physiology. The aims of this package are to: 1) study electrocardiography (both intervals and morphology) as extensions of signal processing, 2) study circadian rhythms and how it effects autonomic physiology, 3) assess clinical risk of autonomic dysfunction on cardiovascular health through the perspective of epidemiology and causality. The analysis of circadian rhythms through cosinor analysis are built upon the methods by Cornelissen (2014) <doi:10.1186/1742-4682-11-16> and Refinetti, Cornelissen, Halberg (2014) <doi:10.1080/09291010600903692>.",no,no,No
CCpop,One and two locus GWAS of binary phenotype with case-control-population design,"Tests of association between SNPs or pairs of SNPs and binary phenotypes, in case-control / case-population / case-control-population studies.",no,no,No
choiceDes,Design Functions for Choice Studies,Design functions for DCMs and other types of choice studies (including MaxDiff and other tradeoffs).,yes,no,No
crispRdesignR,Guide Sequence Design for CRISPR/Cas9,Designs guide sequences for CRISPR/Cas9 genome editing and provides information on sequence features pertinent to guide efficiency. Sequence features include annotated off-target predictions in a user-selected genome and a predicted efficiency score based on the model described in Doench et al. (2016) <doi:10.1038/nbt.3437>. Users are able to import additional genomes and genome annotation files to use when searching and annotating off-target hits. All guide sequences and off-target data can be generated through the 'R' console with sgRNA_Design() or through 'crispRdesignR's' user interface with crispRdesignRUI(). CRISPR (Clustered Regularly Interspaced Short Palindromic Repeats) and the associated protein Cas9 refer to a technique used in genome editing.,no,no,No
crmPack,Object-Oriented Implementation of CRM Designs,"Implements a wide range of model-based dose escalation designs, ranging from classical and modern continual reassessment methods (CRMs) based on dose-limiting toxicity endpoints to dual-endpoint designs taking into account a biomarker/efficacy outcome. The focus is on Bayesian inference, making it very easy to setup a new design with its own JAGS code. However, it is also possible to implement 3+3 designs for comparison or models with non-Bayesian estimation. The whole package is written in a modular form in the S4 class system, making it very flexible for adaptation to new models, escalation or stopping rules.",yes,no,No
DeclareDesign,Declare and Diagnose Research Designs,"Researchers can characterize and learn about the properties of research designs before implementation using `DeclareDesign`. Ex ante declaration and diagnosis of designs can help researchers clarify the strengths and limitations of their designs and to improve their properties, and can help readers evaluate a research strategy prior to implementation and without access to results. It can also make it easier for designs to be shared, replicated, and critiqued.",no,no,No
deepgp,Sequential Design for Deep Gaussian Processes using MCMC,"Performs model fitting and sequential design for deep Gaussian processes following Sauer, Gramacy, and Higdon (2020) <arXiv:2012.08015>. Models extend up to three layers deep; a one layer model is equivalent to typical Gaussian process regression. Sequential design criteria include integrated mean-squared error (IMSE), active learning Cohn (ALC), and expected improvement (EI). Covariance structure is based on inverse exponentiated squared euclidean distance. Applicable to noisy and deterministic functions. Incorporates SNOW parallelization and utilizes C under the hood.",no,no,No
DesignLibrary,Library of Research Designs,"A simple interface to build designs using the package 'DeclareDesign'. In one line of code, users can specify the parameters of individual designs and diagnose their properties. The designers can also be used to compare performance of a given design across a range of combinations of parameters, such as effect size, sample size, and assignment probabilities.",no,no,No
desirability,Function Optimization and Ranking via Desirability Functions,S3 classes for multivariate optimization using the desirability function by Derringer and Suich (1980).,yes,no,No
DiceEval,Construction and Evaluation of Metamodels,"Estimation, validation and prediction of models of different types : linear models, additive models, MARS,PolyMARS and Kriging.",yes,no,No
DOS,Design of Observational Studies,"Contains data sets, examples and software from the book Design of Observational Studies by Paul R. Rosenbaum, New York: Springer, <doi:10.1007/978-1-4419-1213-8>, ISBN 978-1-4419-1212-1.",no,no,No
DOS2,"Design of Observational Studies, Companion to the Second Edition","Contains data sets, examples and software from the Second Edition of ""Design of Observational Studies""; see Rosenbaum, P.R. (2010) <doi:10.1007/978-1-4419-1213-8>.",no,no,No
dssd,Distance Sampling Survey Design,"Creates survey designs for distance sampling surveys. These designs can be assessed for various effort and coverage statistics. Once the user is satisfied with the design characteristics they can generate a set of transects to use in their distance sampling survey. Many of the designs implemented in this R package were first made available in our 'Distance' for Windows software and are detailed in Chapter 7 of Advanced Distance Sampling, Buckland et. al. (2008, ISBN-13: 978-0199225873). Find out more about estimating animal/plant abundance with distance sampling at <http://distancesampling.org/>.",no,no,No
DTComPair,Comparison of Binary Diagnostic Tests in a Paired Study Design,"This package contains functions to compare the accuracy of two binary diagnostic tests in a ""paired"" study design, i.e. when each test is applied to each subject in the study.",no,no,No
dynaTree,Dynamic Trees for Learning and Design,"Inference by sequential Monte Carlo for dynamic tree regression and classification models with hooks provided for sequential design and optimization, fully online learning with drift, variable selection, and sensitivity analysis of inputs. Illustrative examples from the original dynamic trees paper are facilitated by demos in the package; see demo(package=""dynaTree"").",yes,no,No
edcc,Economic Design of Control Charts,This package provides a unified approach for Economic Design of Control Charts. The main purpose of this package is to find out the optimal parameters to minimize the ECH (Expected Cost per Hour) of the process.,no,no,No
emon,Tools for Environmental and Ecological Survey Design,Statistical tools for environmental and ecological surveys. Simulation-based power and precision analysis; detection probabilities from different survey designs; visual fast count estimation.,no,no,No
esDesign,Adaptive Enrichment Designs with Sample Size Re-Estimation,"Software of 'esDesign' is developed to implement the adaptive enrichment designs with sample size re-estimation. In details, three-proposed trial designs are provided, including the AED1-SSR (or ES1-SSR), AED2-SSR (or ES2-SSR) and AED3-SSR (or ES3-SSR). In addition, this package also contains several widely used adaptive designs, such as the Marker Sequential Test (MaST) design proposed Freidlin et al. (2014) <doi:10.1177/1740774513503739>, the adaptive enrichment designs without early stopping (AED or ES), the sample size re-estimation procedure (SSR) based on the conditional power proposed by Proschan and Hunsberger (1995), and some useful functions. In details, we can calculate the futility and/or efficacy stopping boundaries, the sample size required, calibrate the value of the threshold of the difference between subgroup-specific test statistics, conduct the simulation studies in AED, SSR, AED1-SSR, AED2-SSR and AED3-SSR.",no,no,No
factorial2x2,Design and Analysis of a 2x2 Factorial Trial,"Used for the design and analysis of a 2x2 factorial trial for a time-to-event endpoint. It performs power calculations and significance testing as well as providing estimates of the relevant hazard ratios and the corresponding 95% confidence intervals. Important reference papers include Slud EV. (1994) <https://www.ncbi.nlm.nih.gov/pubmed/8086609> Lin DY, Gong J, Gallo P, Bunn PH, Couper D. (2016) <DOI:10.1111/biom.12507> Leifer ES, Troendle JF, Kolecki A, Follmann DA. (2020) <https://github.com/EricSLeifer/factorial2x2/blob/master/Leifer%20et%20al.%20paper.pdf>.",no,no,No
FisPro,Fuzzy Inference System Design and Optimization,"Fuzzy inference systems are based on fuzzy rules, which have a good capability for managing progressive phenomenons. This package is a basic implementation of the main functions to use a Fuzzy Inference System (FIS) provided by the open source software 'FisPro' <https://www.fispro.org>. 'FisPro' allows to create fuzzy inference systems and to use them for reasoning purposes, especially for simulating a physical or biological system.",no,no,No
flowr,Streamlining Design and Deployment of Complex Workflows,"This framework allows you to design and implement complex pipelines, and deploy them on your institution's computing cluster. This has been built keeping in mind the needs of bioinformatics workflows. However, it is easily extendable to any field where a series of steps (shell commands) are to be executed in a (work)flow.",no,no,No
forestinventory,Design-Based Global and Small-Area Estimations for Multiphase Forest Inventories,"Extensive global and small-area estimation procedures for multiphase forest inventories under the design-based Monte-Carlo approach are provided. The implementation has been published in the Journal of Statistical Software (<doi:10.18637/jss.v097.i04>) and includes estimators for simple and cluster sampling published by Daniel Mandallaz in 2007 (<doi:10.1201/9781584889779>), 2013 (<doi:10.1139/cjfr-2012-0381>, <doi:10.1139/cjfr-2013-0181>, <doi:10.1139/cjfr-2013-0449>, <doi:10.3929/ethz-a-009990020>) and 2016 (<doi:10.3929/ethz-a-010579388>). It provides point estimates, their external- and design-based variances and confidence intervals, as well as a set of functions to analyze and visualize the produced estimates. The procedures have also been optimized for the use of remote sensing data as auxiliary information, as demonstrated in 2018 by Hill et al. (<doi:10.3390/rs10071052>).",no,no,No
FSSF,Generate Fully-Sequential Space-Filling Designs Inside a Unit Hypercube,"Provides three methods proposed by Shang and Apley (2019) <doi:10.1080/00224065.2019.1705207> to generate fully-sequential space-filling designs inside a unit hypercube. A 'fully-sequential space-filling design' means a sequence of nested designs (as the design size varies from one point up to some maximum number of points) with the design points added one at a time and such that the design at each size has good space-filling properties. Two methods target the minimum pairwise distance criterion and generate maximin designs, among which one method is more efficient when design size is large. One method targets the maximum hole size criterion and uses a heuristic to generate what is closer to a minimax design.",no,no,No
GAD,GAD: Analysis of variance from general principles,"This package analyses complex ANOVA models with any combination of orthogonal/nested and fixed/random factors, as described by Underwood (1997). There are two restrictions: (i) data must be balanced; (ii) fixed nested factors are not allowed. Homogeneity of variances is checked using Cochran's C test and 'a posteriori' comparisons of means are done using Student-Newman-Keuls (SNK) procedure.",yes,no,No
GeDS,Geometrically Designed Spline Regression,"Geometrically Designed Spline ('GeDS') Regression is a non-parametric geometrically motivated method for fitting variable knots spline predictor models in one or two independent variables, in the context of generalized (non-)linear models. 'GeDS' estimates the number and position of the knots and the order of the spline, assuming the response variable has a distribution from the exponential family. A description of the method can be found in Kaishev et al. (2016) <doi:10.1007/s00180-015-0621-7> and Dimitrova et al. (2017) <https://openaccess.city.ac.uk/18460>.",no,no,No
genepi,Genetic Epidemiology Design and Inference,Functions for Genetic Epi Methods Developed at MSKCC,no,no,No
genotypeR,SNP Genotype Marker Design and Analysis,"We implement a common genotyping workflow with a standardized software interface. 'genotypeR' designs genotyping markers from vcf files, outputs markers for multiplexing suitability on various platforms (Sequenom and Illumina GoldenGate), and provides various QA/QC and analysis functions. We developed this package to analyze data in Stevison LS, SA Sefick, CA Rushton, and RM Graze. 2017. Invited Review: Recombination rate plasticity: revealing mechanisms by design. Philosophical Transactions Royal Society London B Biol Sci 372:1-14. <DOI:10.1098/rstb.2016.0459>, and have published it here Sefick, S.A., M.A. Castronova, and L.S. Stevison. 2017. GENOTYPER: An integrated R packages for single nuleotide polymorphism genotype marker design and data analysis. Methods in Ecology and Evolution 9: 1318-1323. <DOI: 10.1111/2041-210X.12965>.",no,no,No
geospt,Geostatistical Analysis and Design of Optimal Spatial Sampling Networks,"Estimation of the variogram through trimmed mean, radial basis functions (optimization, prediction and cross-validation), summary statistics from cross-validation, pocket plot, and design of optimal sampling networks through sequential and simultaneous points methods.",yes,no,No
granova,Graphical Analysis of Variance,"This small collection of functions provides what we call elemental graphics for display of anova results. The term elemental derives from the fact that each function is aimed at construction of graphical displays that afford direct visualizations of data with respect to the fundamental questions that drive the particular anova methods. The two main functions are granova.1w (a graphic for one way anova) and granova.2w (a corresponding graphic for two way anova). These functions were written to display data for any number of groups, regardless of their sizes (however, very large data sets or numbers of groups can be problematic). For these two functions a specialized approach is used to construct data-based contrast vectors for which anova data are displayed. The result is that the graphics use straight lines, and when appropriate flat surfaces, to facilitate clear interpretations while being faithful to the standard effect tests in anova. The graphic results are complementary to standard summary tables for these two basic kinds of analysis of variance; numerical summary results of analyses are also provided as side effects. Two additional functions are granova.ds (for comparing two dependent samples), and granova.contr (which provides graphic displays for a priori contrasts). All functions provide relevant numerical results to supplement the graphic displays of anova data. The graphics based on these functions should be especially helpful for learning how the methods have been applied to answer the question(s) posed. This means they can be particularly helpful for students and non-statistician analysts. But these methods should be quite generally helpful for work-a-day applications of all kinds, as they can help to identify outliers, clusters or patterns, as well as highlight the role of non-linear transformations of data. In the case of granova.1w and granova.ds especially, several arguments are provided to facilitate flexibility in the construction of graphics that accommodate diverse features of data, according to their corresponding display requirements. See the help files for individual functions.",yes,no,No
GroupSeq,A GUI-Based Program to Compute Probabilities Regarding Group Sequential Designs,"A graphical user interface to compute group sequential designs based on normally distributed test statistics, particularly critical boundaries, power, drift, and confidence intervals of such designs. All computations are based on the alpha spending approach by Lan-DeMets with various alpha spending functions being available to choose among.",yes,no,No
gsbDesign,Group Sequential Bayes Design,"Group Sequential Operating Characteristics for Clinical, Bayesian two-arm Trials with known Sigma and Normal Endpoints.",yes,no,No
gscounts,Group Sequential Designs with Negative Binomial Outcomes,"Design and analysis of group sequential designs for negative binomial outcomes, as described by T Mütze, E Glimm, H Schmidli, T Friede (2018) <doi:10.1177/0962280218773115>.",no,no,No
gsDesign,Group Sequential Design,Derives group sequential designs and describes their properties.,yes,no,No
GSED,Group Sequential Enrichment Design,"Provides function to apply ""Group sequential enrichment design incorporating subgroup selection"" (GSED) method proposed by Magnusson and Turnbull (2013) <doi:10.1002/sim.5738>.",no,no,No
gset,Group Sequential Design in Equivalence Studies,calculate equivalence and futility boundaries based on the exact bivariate $t$ test statistics for group sequential designs in studies with equivalence hypotheses.,yes,no,No
hetGP,Heteroskedastic Gaussian Process Modeling and Design under Replication,"Performs Gaussian process regression with heteroskedastic noise following Binois, M., Gramacy, R., Ludkovski, M. (2016) <arXiv:1611.05902>. The input dependent noise is modeled as another Gaussian process. Replicated observations are encouraged as they yield computational savings. Sequential design procedures based on the integrated mean square prediction error and lookahead heuristics are provided, and notably fast update functions when adding new observations.",no,no,No
ICBioMark,Data-Driven Design of Targeted Gene Panels for Estimating Immunotherapy Biomarkers,"Implementation of the methodology proposed in 'Data-driven design of targeted gene panels for estimating immunotherapy biomarkers', Bradley and Cannings (2021) <arXiv:2102.04296>. This package allows the user to fit generative models of mutation from an annotated mutation dataset, and then further to produce tunable linear estimators of exome-wide biomarkers. It also contains functions to simulate mutation annotated format (MAF) data, as well as to analyse the output and performance of models.",no,no,No
icensmis,Study Design and Data Analysis in the Presence of Error-Prone Diagnostic Tests and Self-Reported Outcomes,"We consider studies in which information from error-prone diagnostic tests or self-reports are gathered sequentially to determine the occurrence of a silent event. Using a likelihood-based approach incorporating the proportional hazards assumption, we provide functions to estimate the survival distribution and covariate effects. We also provide functions for power and sample size calculations for this setting. Please refer to Xiangdong Gu, Yunsheng Ma, and Raji Balasubramanian (2015) <doi: 10.1214/15-AOAS810>, Xiangdong Gu and Raji Balasubramanian (2016) <doi: 10.1002/sim.6962>, Xiangdong Gu, Mahlet G Tadesse, Andrea S Foulkes, Yunsheng Ma, and Raji Balasubramanian (2020) <doi: 10.1186/s12911-020-01223-w>.",no,no,No
ICODS,Data Analysis for ODS and Case-Cohort Designs with Interval-Censoring,"Sieve semiparametric likelihood methods for analyzing interval-censored failure time data from an outcome-dependent sampling (ODS) design and from a case-cohort design. Zhou, Q., Cai, J., and Zhou, H. (2018) <doi:10.1111/biom.12744>; Zhou, Q., Zhou, H., and Cai, J. (2017) <doi:10.1093/biomet/asw067>.",no,no,No
IDPmisc,'Utilities of Institute of Data Analyses and Process Design (www.zhaw.ch/idp)',"Different high-level graphics functions for displaying large datasets, displaying circular data in a very flexible way, finding local maxima, brewing color ramps, drawing nice arrows, zooming 2D-plots, creating figures with differently colored margin and plot region. In addition, the package contains auxiliary functions for data manipulation like omitting observations with irregular values or selecting data by logical vectors, which include NAs. Other functions are especially useful in spectroscopy and analyses of environmental data: robust baseline fitting, finding peaks in spectra, converting humidity measures.",no,no,No
JMdesign,Joint Modeling of Longitudinal and Survival Data - Power Calculation,"Performs power calculations for joint modeling of longitudinal and survival data with k-th order trajectories when the variance-covariance matrix, Sigma_theta, is unknown.",yes,no,No
LatticeDesign,Lattice-Based Space-Filling Designs,"Lattice-based space-filling designs with fill or separation distance properties including interleaved lattice-based minimax distance designs proposed in Xu He (2017) <doi:10.1093/biomet/asx036>, interleaved lattice-based maximin distance designs proposed in Xu He (2018) <doi:10.1093/biomet/asy069>, (sliced) rotated sphere packing designs proposed in Xu He (2017) <doi:10.1080/01621459.2016.1222289> and Xu He (2019) <doi:10.1080/00401706.2018.1458655>, and densest packing-based maximum projections designs proposed in Xu He (2020) <doi:10.1093/biomet/asaa057> and Xu He (2018) <arXiv:1709.02062v2>.",no,no,No
lhs,Latin Hypercube Samples,Provides a number of methods for creating and augmenting Latin Hypercube Samples and Orthogonal Array Latin Hypercube Samples.,yes,no,No
LibOPF,Design of Optimum-Path Forest Classifiers,"The 'LibOPF' is a framework to develop pattern recognition techniques based on optimum-path forests (OPF), João P. Papa and Alexandre X. Falcão (2008) <doi:10.1007/978-3-540-89639-5_89>, with methods for supervised learning and data clustering.",no,no,No
MAMS,Designing Multi-Arm Multi-Stage Studies,Designing multi-arm multi-stage studies with (asymptotically) normal endpoints and known variance.,yes,no,No
maximin,Space-Filling Design under Maximin Distance,Constructs a space-filling design under the criterion of maximum-minimum distance. Both discrete and continuous searches are provided.,no,no,No
MBHdesign,Spatial Designs for Ecological and Environmental Surveys,"Provides spatially balanced designs from a set of (contiguous) potential sampling locations in a study region for point-based and for transect-based surveys. Accommodates, without detrimental effects on spatial balance, sites that the researcher wishes to include in the survey for reasons other than the current randomisation (legacy sites).",yes,yes,No
MCPMod,Design and Analysis of Dose-Finding Studies,"Implements a methodology for the design and analysis of dose-response studies that combines aspects of multiple comparison procedures and modeling approaches (Bretz, Pinheiro and Branson, 2005, Biometrics 61, 738-748, <doi: 10.1111/j.1541-0420.2005.00344.x>). The package provides tools for the analysis of dose finding trials as well as a variety of tools necessary to plan a trial to be conducted with the MCP-Mod methodology. Please note: The 'MCPMod' package will not be further developed, all future development of the MCP-Mod methodology will be done in the 'DoseFinding' R-package.",no,no,No
MCPModPack,Simulation-Based Design and Analysis of Dose-Finding Trials,"An efficient implementation of the MCPMod (Multiple Comparisons and Modeling) method to support a simulation-based design and analysis of dose-finding trials with normally distributed, binary and count endpoints (Bretz et al. (2005) <doi:10.1111/j.1541-0420.2005.00344.x>).",no,no,No
