Package,Title,Description,taskview_doe,taskview_survey,criteria
LDOD,Finding Locally D-optimal optimal designs for some nonlinear and generalized linear models,"this package provides functions for Finding Locally D-optimal designs for Logistic, Negative Binomial, Poisson, Michaelis-Menten, Exponential, Log-Linear, Emax, Richards, Weibull and Inverse Quadratic regression models and also functions for auto-constructing Fisher information matrix and Frechet derivative based on some input variables and without user-interfere.",yes,no,DoE
LHD,Latin Hypercube Designs (LHDs),"Contains different algorithms and construction methods for efficient Latin hypercube designs (LHDs) with flexible sizes. Our package is comprehensive since it is capable of generating maximin distance LHDs, maximum projection LHDs, and orthogonal and nearly orthogonal LHDs. Documentations for all the algorithms and construction methods include informative explanation along with corresponding references. This package is particularly useful in the area of Design and Analysis of Experiments (DAE). More specifically, design of computer experiments.",no,no,DoE
MANOVA.RM,Resampling-Based Analysis of Multivariate Data and Repeated Measures Designs,"Implemented are various tests for semi-parametric repeated measures and general MANOVA designs that do neither assume multivariate normality nor covariance homogeneity, i.e., the procedures are applicable for a wide range of general multivariate factorial designs. In addition to asymptotic inference methods, novel bootstrap and permutation approaches are implemented as well. These provide more accurate results in case of small to moderate sample sizes. Furthermore, post-hoc comparisons are provided for the multivariate analyses. Friedrich, S., Konietschke, F. and Pauly, M. (2018) <arXiv:1801.08002>.",no,no,DoE
MaxPro,Maximum Projection Designs,"Generate maximum projection (MaxPro) designs for quantitative and/or qualitative factors. Details of the MaxPro criterion can be found in: (1) Joseph, Gul, and Ba. (2015) ""Maximum Projection Designs for Computer Experiments"", Biometrika, 102, 371-380, and (2) Joseph, Gul, and Ba. (2018) ""Designing Computer Experiments with Multiple Types of Factors: The MaxPro Approach"", Journal of Quality Technology, to appear.",yes,no,DoE
microsamplingDesign,Finding Optimal Microsampling Designs for Non-Compartmental Pharmacokinetic Analysis,"Find optimal microsampling designs for non-compartmental pharacokinetic analysis using a general simulation methodology: Algorithm III of Barnett, Helen, Helena Geys, Tom Jacobs, and Thomas Jaki. (2017) ""Optimal Designs for Non-Compartmental Analysis of Pharmacokinetic Studies. (currently unpublished)"" This methodology consist of (1) specifying a pharmacokinetic model including variability among animals; (2) generating possible sampling times; (3) evaluating performance of each time point choice on simulated data; (4) generating possible schemes given a time point choice and additional constraints and finally (5) evaluating scheme performance on simulated data. The default settings differ from the article of Barnett and others, in the default pharmacokinetic model used and the parameterization of variability among animals. Details can be found in the package vignette. A 'shiny' web application is included, which guides users from model parametrization to optimal microsampling scheme.",no,no,DoE
MinEDfind,A Bayesian Design for Minimum Effective Dosing-Finding Trial,"The nonparametric two-stage Bayesian adaptive design is a novel phase II clinical trial design for finding the minimum effective dose (MinED). This design is motivated by the top priority and concern of clinicians when testing a new drug, which is to effectively treat patients and minimize the chance of exposing them to subtherapeutic or overly toxic doses. It is used to design single-agent trials.",no,no,DoE
mixexp,Design and Analysis of Mixture Experiments,"Functions for creating designs for mixture experiments, making ternary contour plots, and making mixture effect plots.",yes,no,DoE
mkssd,Efficient multi-level k-circulant supersaturated designs,mkssd is a package that generates efficient balanced non-aliased multi-level k-circulant supersaturated designs by interchanging the elements of the generator vector. The package tries to generate a supersaturated design that has chisquare efficiency more than user specified efficiency level (mef). The package also displays the progress of generation of an efficient multi-level k-circulant design through a progress bar. The progress of 100% means that one full round of interchange is completed. More than one full round (typically 4-5 rounds) of interchange may be required for larger designs.,yes,no,DoE
MOLHD,Multiple Objective Latin Hypercube Design,"Generate the optimal maximin distance, minimax distance (only for low dimensions), and maximum projection designs within the class of Latin hypercube designs efficiently for computer experiments. Generate Pareto front optimal designs for each two of the three criteria and all the three criteria within the class of Latin hypercube designs efficiently. Provide criterion computing functions. References of this package can be found in Morris, M. D. and Mitchell, T. J. (1995) <doi:10.1016/0378-3758(94)00035-T>, Lu Lu and Christine M. Anderson-CookTimothy J. Robinson (2011) <doi:10.1198/Tech.2011.10087>, Joseph, V. R., Gul, E., and Ba, S. (2015) <doi:10.1093/biomet/asv002>.",no,no,DoE
mxkssd,Efficient mixed-level k-circulant supersaturated designs,mxkssd is a package that generates efficient balanced mixed-level k-circulant supersaturated designs by interchanging the elements of the generator vector. The package tries to generate a supersaturated design that has EfNOD efficiency more than user specified efficiency level (mef). The package also displays the progress of generation of an efficient mixed-level k-circulant design through a progress bar. The progress of 100 per cent means that one full round of interchange is completed. More than one full round (typically 4-5 rounds) of interchange may be required for larger designs.,yes,no,DoE
NBDesign,Design and Monitoring of Clinical Trials with Negative Binomial Endpoint,"Calculate various functions needed for design and monitoring clinical trials with negative binomial endpoint with variable follow-up. This version has a few changes compared to the previous version 1.0.0, including (1) correct a typo in Type 1 censoring, mtbnull=bnull and (2) restructure the code to account for shape parameter equal to zero, i.e. Poisson scenario.",no,no,DoE
NNTbiomarker,Calculate Design Parameters for Biomarker Validation Studies,"Helps a clinical trial team discuss the clinical goals of a well-defined biomarker with a diagnostic, staging, prognostic, or predictive purpose. From this discussion will come a statistical plan for a (non-randomized) validation trial. Both prospective and retrospective trials are supported. In a specific focused discussion, investigators should determine the range of ""discomfort"" for the NNT, number needed to treat. The meaning of the discomfort range, [NNTlower, NNTupper], is that within this range most physicians would feel discomfort either in treating or withholding treatment. A pair of NNT values bracketing that range, NNTpos and NNTneg, become the targets of the study's design. If the trial can demonstrate that a positive biomarker test yields an NNT less than NNTlower, and that a negative biomarker test yields an NNT less than NNTlower, then the biomarker may be useful for patients. A highlight of the package is visualization of a ""contra-Bayes"" theorem, which produces criteria for retrospective case-controls studies.",no,no,DoE
nparMD,Nonparametric Analysis of Multivariate Data in Factorial Designs,"Analysis of multivariate data with two-way completely randomized factorial design. The analysis is based on fully nonparametric, rank-based methods and uses test statistics based on the Dempster's ANOVA, Wilk's Lambda, Lawley-Hotelling and Bartlett-Nanda-Pillai criteria. The multivariate response is allowed to be ordinal, quantitative, binary or a mixture of the different variable types. The package offers two functions performing the analysis, one for small and the other for large sample sizes. The underlying methodology is largely described in Bathke and Harrar (2016) <doi:10.1007/978-3-319-39065-9_7> and in Munzel and Brunner (2000) <doi:10.1016/S0378-3758(99)00212-8>.",no,no,DoE
nparsurv,"Nonparametric Tests for Main Effects, Simple Effects and Interaction Effect in a Factorial Design with Censored Data","Nonparametric Tests for Main Effects, Simple Effects and Interaction Effect with Censored Data and Two Factorial Influencing Variables.",no,no,DoE
npIntFactRep,Nonparametric Interaction Tests for Factorial Designs with Repeated Measures,"Returns nonparametric aligned rank tests for the interaction in two-way factorial designs, on R data sets with repeated measures in 'wide' format. Five ANOVAs tables are reported. A PARAMETRIC one on the original data, one for a CHECK upon the interaction alignments, and three aligned rank tests: one on the aligned REGULAR, one on the FRIEDMAN, and one on the KOCH ranks. In these rank tests, only the resulting values for the interaction are relevant.",no,no,DoE
nppbib,Nonparametric Partially-Balanced Incomplete Block Design Analysis,Implements a nonparametric statistical test for rank or score data from partially-balanced incomplete block-design experiments.,no,no,DoE
OBsMD,Objective Bayesian Model Discrimination in Follow-Up Designs,"Implements the objective Bayesian methodology proposed in Consonni and Deldossi in order to choose the optimal experiment that better discriminate between competing models, see Deldossi and Nai Ruscone (2020) <doi:10.18637/jss.v094.i02>.",no,no,DoE
odr,Optimal Design and Statistical Power of Multilevel Randomized Trials,"Calculate the optimal sample allocation that produces smallest variance of a treatment effect or the highest statistical power for experimental studies under a budget constraint, perform power analyses with and without accommodating cost structures of sampling, and calculate the relative efficiency between two sample allocations. The references for the proposed methods are: (1) Shen, Z. (2019). Optimal sample allocation in multilevel Experiments. (Doctoral dissertation). University of Cincinnati, Cincinnati, OH. (2) Shen, Z., & Kelcey, B. (in press). Optimal sample allocation under unequal costs in cluster-randomized trials. Journal of Educational and Behavioral Statistics. (3) Champely., S. (2018). pwr: Basic functions for power analysis (Version 1.2-2) [Software]. Available from <https://CRAN.R-project.org/package=pwr>.",yes,no,DoE
OPDOE,Optimal Design of Experiments,"Several function related to Experimental Design are implemented here, see ""Optimal Experimental Design with R"" by Rasch D. et. al (ISBN 9781439816974).",yes,no,DoE
Opt5PL,Optimal Designs for the 5-Parameter Logistic Model,"Obtain and evaluate various optimal designs for the 3, 4, and 5-parameter logistic models. The optimal designs are obtained based on the numerical algorithm in Hyun, Wong, Yang (2018) <doi:10.18637/jss.v083.i05>.",no,no,DoE
optbdmaeAT,Optimal Block Designs for Two-Colour cDNA Microarray Experiments,"Computes A-, MV-, D- and E-optimal or near-optimal block designs for two-colour cDNA microarray experiments using the linear fixed effects and mixed effects models where the interest is in a comparison of all possible elementary treatment contrasts. The algorithms used in this package are based on the treatment exchange and array exchange algorithms of Debusho, Gemechu and Haines (2016, unpublished). The package also provides an optional method of using the graphical user interface (GUI) R package tcltk to ensure that it is user friendly.",yes,no,DoE
optDesignSlopeInt,Optimal Designs for Estimating the Slope Divided by the Intercept,Compute optimal experimental designs that measure the slope divided by the intercept.,yes,no,DoE
OptGS,Near-Optimal and Balanced Group-Sequential Designs for Clinical Trials with Continuous Outcomes,Functions to find near-optimal multi-stage designs for continuous outcomes.,yes,no,DoE
OptimalDesign,A Toolbox for Computing Efficient Designs of Experiments,"Algorithms for D-, A-, I-, and c-optimal designs. Some of the functions in this package require the 'gurobi' software and its accompanying R package. For their installation, please follow the instructions at <https://www.gurobi.com> and the file gurobi_inst.txt, respectively.",yes,no,DoE
OptimalRerandExpDesigns,Optimal Rerandomization Experimental Designs,"This is a tool to find the optimal rerandomization threshold in non-sequential experiments. We offer three procedures based on assumptions made on the residuals distribution: (1) normality assumed (2) excess kurtosis assumed (3) entire distribution assumed. Illustrations are included. Also included is a routine to unbiasedly estimate Frobenius norms of variance-covariance matrices. Details of the method can be found in ""Optimal Rerandomization via a Criterion that Provides Insurance Against Failed Experiments"" Adam Kapelner, Abba M. Krieger, Michael Sklar and David Azriel (2020) <arXiv:1905.03337>.",no,no,DoE
optrcdmaeAT,Optimal Row-Column Designs for Two-Colour cDNA Microarray Experiments,"Computes A-, MV-, D- and E-optimal or near-optimal row-column designs for two-colour cDNA microarray experiments using the linear fixed effects and mixed effects models where the interest is in a comparison of all pairwise treatment contrasts. The algorithms used in this package are based on the array exchange and treatment exchange algorithms adopted from Debusho, Gemechu and Haines (2016, unpublished) algorithms after adjusting for the row-column designs setup. The package also provides an optional method of using the graphical user interface (GUI) R package tcltk to ensure that it is user friendly.",yes,no,DoE
OWEA,Optimal Weight Exchange Algorithm for Optimal Designs for Three Models,"An implementation of optimal weight exchange algorithm Yang(2013) <doi:10.1080/01621459.2013.806268> for three models. They are Crossover model with subject dropout, crossover model with proportional first order residual effects and interference model. You can use it to find either A-opt or D-opt approximate designs. Exact designs can be automatically rounded from approximate designs and relative efficiency is provided as well.",no,no,DoE
pauwels2014,Bayesian Experimental Design for Systems Biology,"Implementation of a Bayesian active learning strategy to carry out sequential experimental design in the context of biochemical network kinetic parameter estimation. This package gathers functions and pre-computed data sets to reproduce results presented in Pauwels E. et. al published in BMC Systems Biology, 2014. Scripts are given to compute all results from scratch or to draw pictures based on pre-computed data sets.",no,no,DoE
PBIBD,Partially Balanced Incomplete Block Designs,"The PBIB designs are important type of incomplete block designs having wide area of their applications for example in agricultural experiments, in plant breeding, in sample surveys etc. This package constructs various series of PBIB designs and assists in checking all the necessary conditions of PBIB designs and the association scheme on which these designs are based on. It also assists in calculating the efficiencies of PBIB designs with any number of associate classes. The package also constructs Youden-m square designs which are Row-Column designs for the two-way elimination of heterogeneity. The incomplete columns of these Youden-m square designs constitute PBIB designs. With the present functionality, the package will be of immense importance for the researchers as it will help them to construct PBIB designs, to check if their PBIB designs and association scheme satisfy various necessary conditions for the existence, to calculate the efficiencies of PBIB designs based on any association scheme and to construct Youden-m square designs for the two-way elimination of heterogeneity. R. C. Bose and K. R. Nair (1939) <http://www.jstor.org/stable/40383923>.",yes,no,DoE
PGM2,Nested Resolvable Designs and their Associated Uniform Designs,Construction method of nested resolvable designs from a projective geometry defined on Galois field of order 2. The obtained Resolvable designs are used to build uniform design. The presented results are based on <https://eudml.org/doc/219563> and A. Boudraa et al. (See references).,yes,no,DoE
ph2bayes,Bayesian Single-Arm Phase II Designs,An implementation of Bayesian single-arm phase II design methods for binary outcome based on posterior probability (Thall and Simon (1994) <doi:10.2307/2533377>) and predictive probability (Lee and Liu (2008) <doi:10.1177/1740774508089279>).,yes,no,DoE
ph2bye,Phase II Clinical Trial Design Using Bayesian Methods,Calculate the Bayesian posterior/predictive probability and determine the sample size and stopping boundaries for single-arm Phase II design.,yes,no,DoE
ph2mult,Phase II Clinical Trial Design for Multinomial Endpoints,"Provide multinomial design methods under intersection-union test (IUT) and union-intersection test (UIT) scheme for Phase II trial. The design types include : Minimax (minimize the maximum sample size), Optimal (minimize the expected sample size), Admissible (minimize the Bayesian risk) and Maxpower (maximize the exact power level).",no,no,DoE
phase1PRMD,Personalized Repeated Measurement Design for Phase I Clinical Trials,"Implements Bayesian phase I repeated measurement design that accounts for multidimensional toxicity endpoints and longitudinal efficacy measure from multiple treatment cycles. The package provides flags to fit a variety of model-based phase I design, including 1 stage models with or without individualized dose modification, 3-stage models with or without individualized dose modification, etc. Functions are provided to recommend dosage selection based on the data collected in the available patient cohorts and to simulate trial characteristics given design parameters. Yin, Jun, et al. (2017) <doi:10.1002/sim.7134>.",no,no,DoE
phase1RMD,Repeated Measurement Design for Phase I Clinical Trial,"Implements our Bayesian phase I repeated measurement design that accounts for multidimensional toxicity endpoints from multiple treatment cycles. The package also provides a novel design to account for both multidimensional toxicity endpoints and early-stage efficacy endpoints in the phase I design. For both designs, functions are provided to recommend the next dosage selection based on the data collected in the available patient cohorts and to simulate trial characteristics given design parameters. Yin, Jun, et al. (2017) <doi:10.1002/sim.7134>.",no,no,DoE
pid,Process Improvement using Data,"A collection of scripts and data files for the statistics text: ""Process Improvement using Data"" <https://learnche.org/pid> and the online course ""Experimentation for Improvement"" found on Coursera. The package contains code for designed experiments, data sets and other convenience functions used in the book.",yes,no,DoE
pipe.design,Dual-Agent Dose Escalation for Phase I Trials using the PIPE Design,"Implements the Product of Independent beta Probabilities dose Escalation (PIPE) design for dual-agent Phase I trials as described in Mander AP, Sweeting MJ (2015) <DOI:10.1002/sim.6434>.",yes,no,DoE
PopED,Population (and Individual) Optimal Experimental Design,"Optimal experimental designs for both population and individual studies based on nonlinear mixed-effect models. Often this is based on a computation of the Fisher Information Matrix. This package was developed for pharmacometric problems, and examples and predefined models are available for these types of systems. The methods are described in Nyberg et al. (2012) <doi:10.1016/j.cmpb.2012.05.005>, and Foracchia et al. (2004) <doi:10.1016/S0169-2607(03)00073-7>.",yes,no,DoE
powerAnalysis,Power Analysis in Experimental Design,Basic functions for power analysis and effect size calculation.,yes,no,DoE
qtlDesign,Design of QTL experiments,Tools for the design of QTL experiments,yes,no,DoE
radiant.design,Design Menu for Radiant: Business Analytics using R and Shiny,"The Radiant Design menu includes interfaces for design of experiments, sampling, and sample size calculation. The application extends the functionality in radiant.data.",no,no,DoE
rankFD,Rank-Based Tests for General Factorial Designs,"The rankFD() function calculates the Wald-type statistic (WTS) and the ANOVA-type statistic (ATS) for nonparametric factorial designs, e.g., for count, ordinal or score data in a crossed design with an arbitrary number of factors.",no,no,DoE
RcmdrPlugin.DoE,R Commander Plugin for (industrial) Design of Experiments,"The package provides a platform-independent GUI for design of experiments. It is implemented as a plugin to the R-Commander, which is a more general graphical user interface for statistics in R based on tcl/tk. DoE functionality can be accessed through the menu Design that is added to the R-Commander menus.",yes,no,DoE
rdlocrand,Local Randomization Methods for RD Designs,"The regression discontinuity (RD) design is a popular quasi-experimental design for causal inference and policy evaluation. Under the local randomization approach, RD designs can be interpreted as randomized experiments inside a window around the cutoff. This package provides tools to perform randomization inference for RD designs under local randomization: rdrandinf() to perform hypothesis testing using randomization inference, rdwinselect() to select a window around the cutoff in which randomization is likely to hold, rdsensitivity() to assess the sensitivity of the results to different window lengths and null hypotheses and rdrbounds() to construct Rosenbaum bounds for sensitivity to unobserved confounders. See Cattaneo, Titiunik and Vazquez-Bare (2016) <https://rdpackages.github.io/references/Cattaneo-Titiunik-VazquezBare_2016_Stata.pdf> for further methodological details.",no,no,DoE
rdmulti,Analysis of RD Designs with Multiple Cutoffs or Scores,"The regression discontinuity (RD) design is a popular quasi-experimental design for causal inference and policy evaluation. The 'rdmulti' package provides tools to analyze RD designs with multiple cutoffs or scores: rdmc() estimates pooled and cutoff specific effects for multi-cutoff designs, rdmcplot() draws RD plots for multi-cutoff designs and rdms() estimates effects in cumulative cutoffs or multi-score designs. See Cattaneo, Titiunik and Vazquez-Bare (2020) <https://rdpackages.github.io/references/Cattaneo-Titiunik-VazquezBare_2020_Stata.pdf> for further methodological details.",no,no,DoE
rdpower,Power Calculations for RD Designs,"The regression discontinuity (RD) design is a popular quasi-experimental design for causal inference and policy evaluation. The 'rdpower' package provides tools to perform power, sample size and MDE calculations in RD designs: rdpower() calculates the power of an RD design, rdsampsi() calculates the required sample size to achieve a desired power and rdmde() calculates minimum detectable effects. See Cattaneo, Titiunik and Vazquez-Bare (2019) <https://rdpackages.github.io/references/Cattaneo-Titiunik-VazquezBare_2019_Stata.pdf> for further methodological details.",no,no,DoE
rdrobust,Robust Data-Driven Statistical Inference in Regression-Discontinuity Designs,"Regression-discontinuity (RD) designs are quasi-experimental research designs popular in social, behavioral and natural sciences. The RD design is usually employed to study the (local) causal effect of a treatment, intervention or policy. This package provides tools for data-driven graphical and analytical statistical inference in RD designs: rdrobust() to construct local-polynomial point estimators and robust confidence intervals for average treatment effects at the cutoff in Sharp, Fuzzy and Kink RD settings, rdbwselect() to perform bandwidth selection for the different procedures implemented, and rdplot() to conduct exploratory data analysis (RD plots).",no,no,DoE
rld,Analyze and Design Repeated Low-Dose Challenge Experiments,"Analyzes data from repeated low-dose challenge experiments and provide vaccine efficacy estimates. In addition, this package can provide guidance to design repeated low-dose challenge studies.",no,no,DoE
rodd,Optimal Discriminating Designs,"A collection of functions for numerical construction of optimal discriminating designs. At the current moment T-optimal designs (which maximize the lower bound for the power of F-test for regression model discrimination), KL-optimal designs (for lognormal errors) and their robust analogues can be calculated with the package.",yes,no,DoE
rpact,Confirmatory Adaptive Clinical Trial Design and Analysis,"Design and analysis of confirmatory adaptive clinical trials with continuous, binary, and survival endpoints according to the methods described in the monograph by Wassmer and Brannath (2016) <doi:10.1007/978-3-319-32562-0>. This includes classical group sequential as well as multi-stage adaptive hypotheses tests that are based on the combination testing principle.",no,no,DoE
rsm,Response-Surface Analysis,"Provides functions to generate response-surface designs, fit first- and second-order response-surface models, make surface plots, obtain the path of steepest ascent, and do canonical analysis. A good reference on these methods is Chapter 10 of Wu, C-F J and Hamada, M (2009) ""Experiments: Planning, Analysis, and Parameter Design Optimization"" ISBN 978-0-471-69946-0.",yes,no,DoE
